27/09/2024 21:55:49,20,Female,Undergraduated,Business and Finance,Yes,Weekly,Homework assistance,1-3 hours,Strongly agree,Strongly agree,Strongly agree,,Agree,Agree,Agree,,Neutral,Agree,Agree,,
27/09/2024 21:57:56,19,Male,Undergraduated,Electrical Engineering,Yes,Daily,Research,1-3 hours,Agree,Agree,Agree,Beside research it can also help in other terms like life concepts any much more,Neutral,Neutral,Agree,Not any untill now...,Agree,Agree,Neutral,"Well, by using ChatGPT concepts become easier to understand ...",ChatGPT has a good Impact on my Academic Performance...
27/09/2024 21:58:21,23,Female,Undergraduated,Business and Accounting,Yes,Daily,"Research, Homework assistance",1-3 hours,Agree,Strongly agree,Neutral,,Agree,Neutral,Agree,,Neutral,Disagree,Agree,,
27/09/2024 22:01:55,18,Female,Undergraduated,Electrical Engineering,Yes,Monthly,"Homework assistance, General knowledge",1-3 hours,Agree,Strongly agree,Neutral,,Agree,Neutral,Strongly agree,,Agree,Strongly Agree,Agree,,
27/09/2024 22:03:54,23,Female,Undergraduated,Software Engineering,Yes,Rarely,Homework assistance,Less than 1 hour,Strongly agree,Agree,Neutral,,Agree,Neutral,Strongly agree,,Agree,Neutral,Agree,,
27/09/2024 22:05:08,18,Male,Undergraduated,Software Engineering,Yes,Rarely,"Homework assistance, General knowledge",Less than 1 hour,Neutral,Neutral,Neutral,,Disagree,Neutral,Neutral,,Agree,Neutral,Agree,,
27/09/2024 22:15:23,21,Female,Undergraduated,Mechanical Engineering,Yes,Weekly,Homework assistance,Less than 1 hour,Neutral,Neutral,Neutral,Chtgpt help me in making reports nd assignments,Disagree,Neutral,Strongly agree,It make students lazy.. And due to chtgpt their is lack of interest in students especially cs students ,Strongly agree,Strongly Agree,Disagree,Year back i put effort in making assignments.. I do alot of research but now whenever i need to make assignment i just go to chtgpt and make my assignment just in 15 min,Im not dependent on chatgpt as asuch so it's make no difference for me
27/09/2024 22:19:40,23,Male,Undergraduated,Computer Science,No,Monthly,Other,Less than 1 hour,Agree,Neutral,Agree,Easily to find different answers,Neutral,Disagree,Neutral,Not give answer more correctly,Agree,Agree,Agree,It is easy to find any question answer.,Yes
27/09/2024 22:46:41,17,Male,High school,Medical Science,Yes,Daily,"Research, Homework assistance, Other",Less than 1 hour,Strongly agree,Strongly agree,Strongly agree,,Neutral,Agree,Strongly disagree,,Agree,Neutral,Neutral,,
27/09/2024 22:51:56,23,Male,Undergraduated,Business and Finance,Yes,Weekly,"Research, Homework assistance, General knowledge",Less than 1 hour,Neutral,Neutral,Agree,Summarizing papers,Strongly disagree,Agree,Disagree,giving wrong information,Disagree,Disagree,Disagree,No real changes,stayed the same
27/09/2024 22:58:44,20,Female,Undergraduated,Other,Yes,Daily,"Research, Homework assistance, General knowledge",1-3 hours,Agree,Agree,Strongly agree,,Agree,Strongly agree,Neutral,become kinda lazy to do the manual research,Agree,Neutral,Agree,,improved my writing and understanding
27/09/2024 23:02:00,17,Male,Undergraduated,Science and Technology,Yes,Rarely,"Research, General knowledge, Other",Less than 1 hour,Agree,Strongly Disagree,Neutral,,Strongly disagree,Strongly Disagree,Strongly disagree,Due To My Smart Use I Have Not Experienced Even One Negative Effect Of Using ChatGPT,Neutral,Disagree,Disagree,None Due To Controlled Use,In No Way
27/09/2024 23:28:48,20,Male,Undergraduated,Business and Accounting,Yes,Daily,"Research, Homework assistance",Less than 1 hour,Strongly agree,Strongly agree,Strongly agree,I make  easy for writing each and everything on each and every topic ,Strongly,Strongly agree,Strongly agree,I make us lazy  we can used it each and every work we cannot use our own mind,Agree,Agree,Agree,Maybe ,I make a good impact on it
27/09/2024 23:42:25,17,Male,High school,Medical Science,No,Rarely,Other,Less than 1 hour,Agree,Agree,Agree,,Disagree,Strongly Disagree,Strongly disagree,,Strongly agree,Agree,Neutral,,
27/09/2024 23:56:16,18,Male,High school,Other,Yes,Weekly,"Research, Writing, General knowledge, Other",Less than 1 hour,Agree,Agree,Agree,Help in study ,Neutral,Agree,Agree,Good ,Neutral,Agree,Agree,Learning a lot,Yss
28/09/2024 00:25:38,24,Female,Graduated,Other,No,Weekly,Research,Less than 1 hour,Neutral,Neutral,Neutral,,Neutral,Neutral,Neutral,Answer are sometimes not exactly correct on nonpaid version,Neutral,Neutral,Neutral,I try to confirm my answer is correct or not using chatgpt,In good way
28/09/2024 01:06:25,24,Female,Undergraduated,Agriculture,Yes,Monthly,Writing,4-6 hours,Neutral,Neutral,Neutral,,Disagree,Disagree,Strongly agree,,Disagree,Disagree,Agree,,
28/09/2024 01:26:33,20,Male,Undergraduated,Computer Science,Yes,Daily,Research,Less than 1 hour,Agree,Agree,Strongly agree,Bla bla bla,Agree,Agree,Agree,Bla bla bla ,Agree,Strongly Agree,Agree,Bla bla bla ,Bla bla bla 
28/09/2024 01:58:29,under 15,Prefer not to say,High school,Other,Yes,Rarely,"General knowledge, Other",Less than 1 hour,Strongly disagree,Strongly Disagree,Strongly disagree,I mostly use it for fun,Strongly disagree,Strongly agree,Strongly disagree,Some other students use it to cheat,Strongly disagree,Strongly disagree,Disagree,"None, I dislike the use of generative AI","It hasn't personally, I prefer to write my own things"
28/09/2024 05:39:33,18,Male,High school,Medical Science,Yes,Weekly,"Research, Writing, Homework assistance, General knowledge, Other",Less than 1 hour,Strongly agree,Strongly agree,Strongly agree,Got knowledge about other things and ideas which are helpful in my daily life routine ,Neutral,Neutral,Agree,Some knowledge is wrong which impact not only students thinking but also the adults,Agree,Agree,Agree,"Writing skills, learning skills, knowledge got rich about many things which are unknown for me before.",Yes
28/09/2024 06:07:18,19,Male,Undergraduated,Computer Science,Yes,Daily,"Research, Writing, Homework assistance",1-3 hours,Strongly agree,Strongly agree,Strongly agree,.,Strongly,Strongly agree,Strongly agree,.,Strongly agree,Agree,Agree,..,..
28/09/2024 06:47:56,16,Male,High school,Computer Science,No,Rarely,"Research, Writing, Homework assistance, General knowledge, Other",Less than 1 hour,Agree,Agree,Agree,Many more ,Neutral,Disagree,Strongly disagree,Nothing ,Agree,Neutral,Disagree,Concepts ,By giving answer of everything 
28/09/2024 07:27:53,30,Female,Graduated,Arts and Humanities,No,Rarely,General knowledge,Less than 1 hour,Agree,Agree,Strongly agree,It's explain in detail ,Agree,Strongly agree,Strongly agree,No,Agree,Agree,Agree,Nothing ,No
28/09/2024 07:44:05,18,Male,Undergraduated,Medical Science,No,Weekly,Research,Less than 1 hour,Agree,Neutral,Neutral,,Neutral,Neutral,Neutral,,Neutral,Neutral,Disagree,,
28/09/2024 07:58:52,19,Male,Undergraduated,Arts and Humanities,Yes,Rarely,Research,1-3 hours,Neutral,Neutral,Agree,Help in study,Neutral,Neutral,Agree,Research ,Neutral,Agree,Neutral,Knows about new things ,Better 
28/09/2024 08:24:13,20,Male,High school,Arts and Humanities,Yes,Daily,"Homework assistance, General knowledge, Other",1-3 hours,Agree,Strongly agree,Agree,A loot of benefits ,Agree,Agree,Agree,Very useful and very important thing for everyone ,Strongly agree,Strongly Agree,Agree,We can find everything from ChatGPT,Its a very strong and a great way to solve any kind of situation 
28/09/2024 08:54:26,22,Male,High school,Business and Finance,No,Never,General knowledge,Less than 1 hour,Agree,Disagree,Agree,Answer all questions ,Disagree,Neutral,Strongly agree,Good,Agree,Disagree,Neutral,Yes,Yes
28/09/2024 10:10:42,28,Male,Graduated,Other,Yes,Rarely,"Writing, General knowledge",Less than 1 hour,Agree,Agree,Agree,,Disagree,Neutral,Neutral,,Agree,Agree,Agree,Yes,
28/09/2024 10:44:41,19,Male,High school,Computer Science,Yes,Daily,General knowledge,Less than 1 hour,Agree,Agree,Agree,I got information and more cleared view about the things. ,Neutral,Neutral,Neutral,It's sometimes didn't work,Agree,Neutral,Neutral,I need to know things more clearly,Very good at teaching
28/09/2024 11:14:38,22,Male,Graduated,Aerospace Engineering,Yes,Daily,Other,Less than 1 hour,Disagree,Disagree,Neutral,rephrasing ,Disagree,Disagree,Neutral,creativity,Disagree,Disagree,Agree, I have started getting easier examples from Chat gpt,
28/09/2024 11:29:04,23,Male,Undergraduated,Computer Science,Yes,Daily,Research,Less than 1 hour,Strongly agree,Strongly agree,Strongly agree,Fast study,Agree,Disagree,Agree,Over dependence ,Agree,Neutral,Agree,Using ai to understand topics,Its like a personal assistant 
28/09/2024 11:57:03,21,Male,Undergraduated,Computer Science,Yes,Weekly,"Research, Homework assistance, General knowledge",1-3 hours,Strongly agree,Agree,Agree,,Neutral,Agree,Neutral,,Agree,Disagree,Neutral,,
28/09/2024 12:52:21,21,Female,Undergraduated,Software Engineering,Yes,Weekly,"Research, Writing, Homework assistance, General knowledge, Other",1-3 hours,Agree,Strongly agree,Agree,Creating my own course notes easily or being able to plan a schedule more easily,Strongly,Strongly agree,Strongly agree,Becoming too self reliant has made me unable to properly think on my own,Agree,Strongly Agree,Agree,Unable to read course books or anything that has a lot of text instead just straight up summarize the chapter from chatgpt,I would say it helped me reduce the time I spent on looking for resources and stuff but it has reduced my ability to like do it myself
28/09/2024 13:16:45,18,Male,Undergraduated,Computer Science,Yes,Weekly,"Research, General knowledge",Less than 1 hour,Strongly agree,Agree,Strongly agree,"Its interface is user friendly. Besides this, Its algorithm is excellent like it gives exactly the same answer as I would have expected from it in my mind.",Neutral,Neutral,Disagree,,Strongly agree,Agree,Neutral,,
28/09/2024 13:17:30,20,Male,Undergraduated,Other,Yes,Daily,Other,4-6 hours,Agree,Strongly agree,Strongly agree,It help to make difficult concept understanding into simple and provide wide range of information. ,Agree,Neutral,Agree,,Agree,Agree,Agree,"It reduce my time, provide simple and Detailed information which change my point of view about study. ",It improve my research and concept of difficult topics. 
28/09/2024 13:23:16,20,Male,Undergraduated,Other,Yes,Weekly,"Research, Writing, Homework assistance",Less than 1 hour,Agree,Agree,Agree,,Agree,Neutral,Neutral,,Agree,Neutral,Agree,,
28/09/2024 13:23:37,20,Female,Undergraduated,Medical Science,No,Rarely,Research,Less than 1 hour,Agree,Agree,Agree,it helps me getting the answers quickly ,Disagree,Neutral,Neutral,it makes us lethargic,Neutral,Neutral,Agree,None,helps a lot
28/09/2024 17:13:31,19,Female,Undergraduated,Computer Science,Yes,Daily,"Research, Writing, Homework assistance, General knowledge",1-3 hours,Neutral,Agree,Agree,,Neutral,Agree,Strongly agree,,Strongly agree,Strongly Agree,Agree,,
28/09/2024 17:17:15,20,Female,Undergraduated,Computer Science,Yes,Monthly,Homework assistance,Less than 1 hour,Agree,Neutral,Strongly agree,Easier to find information that doesn't appear in google results,Disagree,Strongly agree,Neutral,Information it gives can be incorrect sometimes. I have to use my own judgement,Agree,Neutral,Agree,,
28/09/2024 18:04:56,27,Female,Undergraduated,Other,Yes,Weekly,"Research, Writing",1-3 hours,Strongly agree,Agree,Agree,ChatGPT has access to a vast amount of knowledge and provides a wide range of information on each topic as well as understand and fenerate human-like language ,Strongly,Agree,Agree,Not Always correct. Sometimes provide confusing and misleading information and ,Neutral,Disagree,Agree,I'm no longer a creative writer who writes independently of thought,ChatGPT influenced in both ways; it can positively enhance research efficiency and idea generation but negativelyit facilitate plagiarism and undermine critical thinking 
28/09/2024 19:39:44,23,Female,Undergraduated,Other,Yes,Weekly,Writing,Less than 1 hour,Strongly agree,Strongly agree,Strongly agree,nill,Strongly,Disagree,Strongly agree,nill,Strongly agree,Strongly Agree,Agree,nill,nill
28/09/2024 19:53:37,21,Male,Undergraduated,Other,No,Never,Writing,Less than 1 hour,Agree,Agree,Agree,Chatgtp is an good application for students ,Agree,Agree,Agree,Yes,Agree,Agree,Agree,No,Yes
28/09/2024 19:57:37,21,Female,Undergraduated,Computer Science,Yes,Daily,"Writing, Homework assistance, General knowledge",4-6 hours,Agree,Agree,Agree,Getting knowledge about new trends and technologies. ,Agree,Agree,Agree,Totally making reliable on gpt is the biggest drawback I have experienced ,Agree,Agree,Agree,Interactive learning platform.,"It works lika a working assistant, idea generator and much more ."
28/09/2024 20:25:58,26,Female,Graduated,Science and Technology,Yes,Daily,Other,1-3 hours,Agree,Agree,Agree,Enhanced creative writing ,Disagree,Neutral,Agree,None ,Agree,Agree,Agree,Different way of thinking ,Academics become better 
28/09/2024 21:03:18,26,Female,Graduated,Arts and Humanities,Yes,Rarely,Writing,Less than 1 hour,Neutral,Agree,Agree,Gives ideas ,Disagree,Agree,Neutral,A person can't think critically more. ,Neutral,Agree,Agree,Not any,Yes
28/09/2024 21:08:20,22,Male,Undergraduated,Computer Science,Yes,Daily,"Research, Writing, Homework assistance, General knowledge",7 hours or more,Agree,Agree,Agree,Improved logic building and problem solving ,Agree,Strongly agree,Neutral,False responses,Agree,Neutral,Agree,Not much changes,It helps alot
28/09/2024 21:11:00,21,Female,Graduated,Science and Technology,Yes,Rarely,Research,Less than 1 hour,Strongly agree,Strongly agree,Agree,In writing and translation it's very helpful for me ,Neutral,Agree,Agree,It's an amazing website helpful in everyfeild ,Strongly agree,Strongly Agree,Agree,Because of chatGTP I learn everything easily without any difficulty ,I think chat GTP is benifical for us but one bad impact is that it decreased our creative thinking style now our own mind creativity level down becomes low because of chatGTP 
28/09/2024 22:20:12,26,Female,Graduated,Arts and Humanities,Yes,Daily,"Research, Writing, General knowledge, Other",Less than 1 hour,Strongly agree,Agree,Strongly agree,,Agree,Agree,Agree,,Agree,Agree,Agree,,
29/09/2024 00:52:47,20,Male,Undergraduated,Software Engineering,Yes,Daily,"Research, Writing, Homework assistance, General knowledge",Less than 1 hour,Strongly agree,Agree,Agree,better understanding and personalized explanation ,Neutral,Agree,Neutral,,Agree,Disagree,Agree,research has become easy,"yes ,in a positive manner"
29/09/2024 08:30:11,21,Male,Undergraduated,Business and Accounting,Yes,Rarely,"General knowledge, Other",Less than 1 hour,Agree,Neutral,Agree,Getting the resources easily. And in easy format to understand ,Disagree,Neutral,Disagree,Not fully reliable. ,Agree,Disagree,Disagree,"Not exactly, because I am not fully relied on them ",Not much 
29/09/2024 11:45:28,19,Male,Undergraduated,Software Engineering,Yes,Daily,"Research, Writing, Homework assistance",Less than 1 hour,Strongly agree,Strongly agree,Agree,Now I can build my projects faster where I stuck I get help from chat gpt,Disagree,Agree,Disagree,Sometimes it don't give you exact solution you need you also should have understanding about the thing you are otherwise you will be stucked,Agree,Agree,Neutral,now I can learn thing faster and easier because now I don't have to rely on Google and spend hours to find my answer ,"yes,Greatly improved "
29/09/2024 12:27:38,21,Male,Undergraduated,Computer Science,Yes,Weekly,Research,Less than 1 hour,Agree,Neutral,Strongly agree,Easy learning ,Strongly disagree,Disagree,Strongly agree,Lack of knowledge ,Neutral,Strongly Agree,Neutral,Easiest way of learning ,Yes
29/09/2024 13:21:22,17,Male,High school,Computer Science,No,Rarely,Research,Less than 1 hour,Agree,Neutral,Neutral,It gives us the easiest and understandable answerss,Neutral,Agree,Disagree,Sometimes it gives us error while  Solving any answer,Agree,Neutral,Agree,Nothing,Yess
29/09/2024 15:04:45,20,Prefer not to say,Undergraduated,Other,No,Weekly,"Research, General knowledge, Other",1-3 hours,Agree,Agree,Strongly agree,It's help me with my studies ,Agree,Neutral,Agree,,Agree,Agree,Agree,,
29/09/2024 16:54:18,18,Female,Undergraduated,Other,No,Rarely,"Homework assistance, General knowledge",Less than 1 hour,Agree,Neutral,Neutral,Normal,Agree,Agree,Neutral,,Neutral,Agree,Neutral,Sentences skills,
29/09/2024 17:06:55,18,Female,Undergraduated,Other,No,Daily,Homework assistance,Less than 1 hour,Agree,Neutral,Agree,,Agree,Neutral,Agree,,Agree,Neutral,Disagree,,
29/09/2024 17:19:34,19,Female,Undergraduated,Other,No,Rarely,Research,Less than 1 hour,Neutral,Neutral,Neutral,Many other related to work,Neutral,Neutral,Neutral,Not that much ,Neutral,Disagree,Neutral,Nothing ,Increase in knowledge 
29/09/2024 17:59:36,Above 40,Female,High school,Arts and Humanities,No,Never,Homework assistance,Less than 1 hour,Strongly disagree,Strongly Disagree,Strongly disagree,,Strongly disagree,Strongly Disagree,Strongly disagree,,Strongly disagree,Strongly disagree,Disagree,I don't have to study at all. ChatGPT does everything for me,Significantly positively
29/09/2024 18:03:00,20,Male,High school,Computer Science,Yes,Daily,"Research, Homework assistance, General knowledge",1-3 hours,Neutral,Neutral,Strongly agree,Simple explanation of complex concepts,Disagree,Disagree,Disagree,,Strongly agree,Disagree,Agree,Its easier now to get answers to complex questions that I couldn't ask correctly,It has made it faster to learn
29/09/2024 20:49:51,22,Female,Undergraduated,Computer Science,No,Daily,General knowledge,1-3 hours,Agree,Agree,Agree,Good ,Neutral,Neutral,Agree,,Agree,Disagree,Agree,,
30/09/2024 01:48:31,23,Female,Graduated,Computer Science,Yes,Daily,Writing,Less than 1 hour,Agree,Agree,Agree,No,Agree,Agree,Agree,Good,Agree,Agree,Agree,Everything is good,Good
30/09/2024 09:02:39,23,Female,Undergraduated,Medical Science,Yes,Monthly,General knowledge,1-3 hours,Agree,Agree,Agree,It increase my knowledge ,Neutral,Agree,Neutral,Limited time of search ,Agree,Agree,Agree,Improved knowledge ,Yes helps me alot
30/09/2024 11:37:15,21,Male,Undergraduated,Computer Science,Yes,Daily,"Research, Writing, Homework assistance",1-3 hours,Neutral,Neutral,Strongly agree,Helps in every aspect of life,Strongly,Agree,Strongly agree,..,Agree,Agree,Agree,Reduce research work ,improved
30/09/2024 11:49:52,18,Male,Undergraduated,Civil Engineering,No,Rarely,"Research, General knowledge",Less than 1 hour,Agree,Strongly Disagree,Disagree,Nothing ,Agree,Disagree,Strongly agree,People are lazy,Neutral,Disagree,Disagree,Nothing,Yes 
30/09/2024 11:50:11,18,Male,Undergraduated,Civil Engineering,No,Daily,Research,Less than 1 hour,Strongly agree,Neutral,Agree,It helps in our homework,Agree,Agree,Agree,,Agree,Neutral,Agree,,
30/09/2024 11:52:08,20,Male,Undergraduated,Software Engineering,Yes,Weekly,Homework assistance,Less than 1 hour,Neutral,Agree,Neutral,Can get code for java,Neutral,Disagree,Neutral,No side effects,Agree,Neutral,Neutral,No changes uses very rarely,No effect
30/09/2024 12:03:28,20,Female,Undergraduated,Electrical Engineering,No,Rarely,Homework assistance,Less than 1 hour,Agree,Neutral,Agree,,Neutral,Neutral,Agree,,Neutral,Disagree,Agree,,
30/09/2024 12:07:21,19,Male,Undergraduated,Civil Engineering,Yes,Weekly,Research,Less than 1 hour,Agree,Agree,Neutral,,Neutral,Disagree,Neutral,,Neutral,Agree,Neutral,,
30/09/2024 12:11:23,18,Male,Undergraduated,Civil Engineering,Yes,Rarely,Research,Less than 1 hour,Agree,Disagree,Neutral,It decreased my time consuption.,Disagree,Neutral,Agree,,Disagree,Disagree,Agree,Chat gpt inhance your writing skills,They provide extra information 
30/09/2024 12:12:11,18,Male,Undergraduated,Civil Engineering,No,Weekly,Writing,Less than 1 hour,Agree,Agree,Neutral,It decreased my time consumption and some how improved my writing skills. ,Neutral,Disagree,Neutral,I have got not much detail which is required.,Agree,Agree,Agree,Not fruitful. ,.
30/09/2024 12:12:45,21,Female,Undergraduated,Computer Science,Yes,Daily,Other,1-3 hours,Neutral,Agree,Agree,For learning and communicating skills improvement,Agree,Agree,Agree,Decrease in your critical and logical skills ,Neutral,Neutral,Agree,.,.
30/09/2024 12:12:52,19,Female,Undergraduated,Computer Science,No,Never,General knowledge,Less than 1 hour,Agree,Agree,Agree,I actually don't use ChatGPT,Disagree,Agree,Agree,I never used ChatGPT  so I don't know ,Agree,Agree,Agree,Reasoning ,Helpful 
30/09/2024 12:19:39,18,Male,Undergraduated,Software Engineering,Yes,Rarely,General knowledge,Less than 1 hour,Neutral,Disagree,Agree,I use chatgpt for gaining knowledge ,Disagree,Disagree,Agree,I can replace human thinking ,Disagree,Agree,Disagree,No changes,By gaining knowledge 
30/09/2024 13:29:51,20,Female,Undergraduated,Aerospace Engineering,Yes,Monthly,Research,Less than 1 hour,Strongly agree,Disagree,Neutral,,Neutral,Agree,Strongly agree,,Agree,Agree,Agree,,
30/09/2024 17:44:10,25,Male,High school,Agriculture,No,Monthly,General knowledge,7 hours or more,Neutral,Strongly Disagree,Disagree,L,Strongly,Strongly agree,Strongly agree,F,Strongly disagree,Strongly Agree,Disagree,LPC,xyz
30/09/2024 21:31:15,21,Male,Undergraduated,Civil Engineering,Yes,Monthly,"Research, Writing, Homework assistance",Less than 1 hour,Strongly agree,Agree,Agree,,Agree,Agree,Agree,,Agree,Agree,Agree,,
1/10/2024 1:50,20,Male,Undergraduated,Mechanical Engineering,No,Rarely,"Research, Homework assistance, General knowledge",Less than 1 hour,Strongly agree,Neutral,Agree,Gain Knowledge,Agree,Neutral,Agree,,Agree,Neutral,Agree,Researching,Better
5/10/2024 12:05,26,Male,Graduated,Computer Science,Yes,Daily,"Research, Writing, Homework assistance",7 hours or more,Strongly agree,Strongly agree,Agree,Forming my documents or content,Agree,Strongly agree,Agree,Brainstorming,Agree,Strongly Agree,Agree,Laziness,Got good grades
5/10/2024 19:50,18,Male,High school,Computer Science,No,Rarely,General knowledge,Less than 1 hour,Strongly agree,Neutral,Neutral,Understanding and easy why of reaching to the correct answer ,Agree,Neutral,Neutral,Nothing ,Neutral,Neutral,Agree,Nothing else,We can easily get answer of any question
6/10/2024 23:15,20,Male,High school,Civil Engineering,No,Rarely,Other,Less than 1 hour,Strongly agree,Strongly agree,Strongly agree,,Neutral,Neutral,Agree,,Neutral,Neutral,Neutral,,
7/10/2024 11:22,20,Male,Undergraduated,Computer Science,Yes,Daily,"Research, Writing, Homework assistance, General knowledge",1-3 hours,Agree,Agree,Agree,Not quite sure,Neutral,Agree,Agree,Not qyite sure,Strongly agree,Strongly Agree,Agree,"I have started relying on GPT alot, it helps me out with different tasks and is helping me out to be a better student.",It's made it a lot better.
9/10/2024 12:30,19,Male,Undergraduated,Business and Accounting,Yes,Rarely,"Research, General knowledge",Less than 1 hour,Agree,Agree,Agree,Its good until not used for any shortcuts and cheating stuff,Strongly disagree,Strongly Disagree,Strongly disagree,Not at all everything have positive and nagative use it depends on us,Neutral,Strongly disagree,Disagree,Nothing not at all,"Well yes, by positive use of it"
9/10/2024 12:58,24,Male,Undergraduated,Civil Engineering,No,Weekly,Research,Less than 1 hour,Strongly agree,Strongly agree,Strongly agree,More,Agree,Agree,Agree,Not any,Agree,Agree,Agree,Relying on chatgpt ,Enhanced 
9/10/2024 22:11,22,Male,Undergraduated,Electrical Engineering,No,Rarely,"Research, Writing, Homework assistance, General knowledge, Other",Less than 1 hour,Agree,Agree,Neutral,,Strongly,Agree,Agree,,Agree,Agree,Agree,,
16/10/2024 00:22:38,18,Female,Undergraduated,Other,No,Weekly,Research,Less than 1 hour,Agree,Strongly agree,Agree,,Neutral,Neutral,Agree,I don't have any experience ,Strongly agree,Agree,Neutral,,
3/11/2024 18:43,23,Female,Graduated,Other,Yes,Weekly,"Research, Writing, Homework assistance, General knowledge",4-6 hours,Agree,Agree,Agree,,Agree,Strongly agree,Agree,,Agree,Agree,Agree,,
24/05/2024 08:24:50,22,Male,Graduated,Engineering,No,Daily,"Research, Writing",Less than 1 hour,Neutral,Neutral,Agree,Helpful website,Neutral,Neutral,Agree,,Agree,Disagree,Agree,Saves time on assignments,
28/05/2024 20:18:55,20,Prefer not to say,Graduated,Engineering,Yes,Rarely,Homework assistance,3-5 hours,Disagree,Disagree,Agree,,Disagree,Neutral,Disagree,,Agree,Neutral,Neutral,It's a useful tool,
17/09/2024 15:32:33,22,Male,Undergraduated,Medicine,Yes,Weekly,General knowledge,3-5 hours,Disagree,Agree,Agree,,Agree,Neutral,Agree,,Neutral,Disagree,Agree,Helpful website,
11/7/2024 16:36,22,Prefer not to say,Graduated,Engineering,No,Weekly,"Writing, Homework assistance",1-3 hours,Disagree,Disagree,Disagree,Improves research skills,Agree,Agree,Disagree,,Agree,Agree,Neutral,,
23/06/2024 02:23:19,25,Female,Undergraduated,Computer Science,No,Never,"Research, Writing",1-3 hours,Neutral,Agree,Neutral,resolve complex queries,Agree,Disagree,Neutral,,Neutral,Disagree,Neutral,It's a useful tool,
20/08/2024 09:46:56,25,Female,Undergraduated,Arts,Yes,Daily,Homework assistance,Less than 1 hour,Disagree,Disagree,Disagree,Helpful website,Disagree,Agree,Agree,,Disagree,Disagree,Neutral,Saves time on assignments,
20/03/2024 12:47:05,25,Prefer not to say,Undergraduated,Arts,No,Weekly,"Research, Writing",Less than 1 hour,Disagree,Agree,Neutral,It's a useful tool,Disagree,Agree,Agree,,Agree,Disagree,Agree,resolve complex queries,
5/9/2024 7:39,24,Male,Graduated,Social Sciences,No,Never,"Research, Homework assistance",More than 5 hours,Agree,Agree,Agree,Improves research skills,Disagree,Neutral,Disagree,,Disagree,Neutral,Neutral,,
9/9/2024 7:49,18,Female,Graduated,Social Sciences,No,Never,"Research, Homework assistance",Less than 1 hour,Disagree,Disagree,Neutral,Helpful website,Neutral,Agree,Agree,,Neutral,Agree,Neutral,Helpful website,
